{"$id":"yggdrasil/contracts/v1/citizen_profile","$schema":"https://json-schema.org/draft/2020-12/schema","additionalProperties":false,"properties":{"accepted_arches":{"items":{"type":"string"},"minItems":1,"type":"array"},"battery_policy":{"additionalProperties":false,"properties":{"critical_below_percent":{"maximum":100,"minimum":0,"type":"number"},"shed_below_percent":{"maximum":100,"minimum":0,"type":"number"},"version":{"const":1}},"required":["version","shed_below_percent","critical_below_percent"],"type":"object"},"citizen":{"pattern":"^[a-z][a-z0-9-]*$","type":"string"},"device_class":{"type":"string"},"governor_policy":{"$ref":"governor_policy.schema.json"},"hailo_rule":{"const":"never_beyond_aesir_ledger"},"max_model_size_gb":{"exclusiveMinimum":0,"type":"number"},"max_slots":{"minimum":1,"type":"integer"},"min_cores":{"minimum":1,"type":"integer"},"min_ram_gb":{"exclusiveMinimum":0,"type":"number"},"min_vram_gb":{"minimum":0,"type":"number"},"neighbour_reserve_gb":{"minimum":0,"type":"number"},"neighbours":{"items":{"additionalProperties":false,"properties":{"kind":{"enum":["service","port","device"],"type":"string"},"name":{"type":"string"},"observation_key":{"pattern":"^[a-z][a-z0-9_]*$","type":"string"},"ref":{"type":"string"}},"required":["name","kind","ref","observation_key"],"type":"object"},"minItems":1,"type":"array"},"profile":{"pattern":"^[a-z0-9][a-z0-9-]*-v[0-9]+$","type":"string"},"required_accelerator_kind":{"enum":["cuda","hailo","npu","metal"],"type":"string"},"roadmap_slice":{"pattern":"^Y-[0-9]{3}$","type":"string"},"version":{"const":1}},"required":["version","profile","roadmap_slice","citizen","device_class","accepted_arches","min_cores","min_ram_gb","governor_policy","neighbour_reserve_gb","max_slots","neighbours","hailo_rule"],"title":"CitizenProfile v1 \u2014 one device-class citizen's requirements and coexistence rules (Y-033; optional required_accelerator_kind / min_vram_gb added by Y-034 for accelerator citizens; optional max_model_size_gb / battery_policy added by Y-036 for the phone citizen)","type":"object"}