{"accepted_arches":["x86_64","amd64"],"citizen":"laptop","device_class":"laptop","governor_policy":{"max_cpu_share":0.85,"max_memory_fraction":0.8,"thermal_hard_c":95.0,"thermal_resume_c":77.0,"thermal_shed_c":85.0,"version":1},"hailo_rule":"never_beyond_aesir_ledger","max_slots":3,"min_cores":8,"min_ram_gb":16.0,"min_vram_gb":4.0,"neighbour_reserve_gb":4.0,"neighbours":[{"kind":"service","name":"user_desktop","observation_key":"desktop_session","ref":"graphical-session"},{"kind":"device","name":"nvidia_device","observation_key":"cuda_device","ref":"/dev/nvidia0"}],"profile":"yggdrasil-laptop-citizen-v1","required_accelerator_kind":"cuda","roadmap_slice":"Y-034","version":1}