{"accepted_arches":["aarch64","arm64"],"battery_policy":{"critical_below_percent":10,"shed_below_percent":20,"version":1},"citizen":"phone","device_class":"phone","governor_policy":{"max_cpu_share":0.5,"max_memory_fraction":0.5,"thermal_hard_c":50.0,"thermal_resume_c":38.0,"thermal_shed_c":45.0,"version":1},"hailo_rule":"never_beyond_aesir_ledger","max_model_size_gb":1.5,"max_slots":1,"min_cores":4,"min_ram_gb":4.0,"neighbour_reserve_gb":2.0,"neighbours":[{"kind":"service","name":"phone_os","observation_key":"phone_os","ref":"phone operating system and the user's own apps"},{"kind":"device","name":"cellular_radio","observation_key":"cellular_radio","ref":"cellular modem / radio"}],"profile":"yggdrasil-phone-citizen-v1","roadmap_slice":"Y-036","version":1}