{"accepted_arches":["aarch64","armv7l"],"citizen":"pi","device_class":"pi","governor_policy":{"max_cpu_share":0.85,"max_memory_fraction":0.75,"thermal_hard_c":85.0,"thermal_resume_c":67.0,"thermal_shed_c":75.0,"version":1},"hailo_rule":"never_beyond_aesir_ledger","max_slots":2,"min_cores":4,"min_ram_gb":3.5,"neighbour_reserve_gb":2.0,"neighbours":[{"kind":"service","name":"samtal","observation_key":"samtal_service","ref":"samtal.service"},{"kind":"port","name":"aurelia","observation_key":"aurelia_port","ref":"8001"},{"kind":"port","name":"kiosk","observation_key":"kiosk_port","ref":"8099"},{"kind":"device","name":"hailo","observation_key":"hailo_device","ref":"/dev/hailo0"}],"profile":"yggdrasil-pi-citizen-v1","roadmap_slice":"Y-033","version":1}