{"accepted_arches":["x86_64","amd64"],"citizen":"vm","device_class":"vm","governor_policy":{"max_cpu_share":0.75,"max_memory_fraction":0.75,"thermal_hard_c":90.0,"thermal_resume_c":72.0,"thermal_shed_c":80.0,"version":1},"hailo_rule":"never_beyond_aesir_ledger","max_slots":2,"min_cores":2,"min_ram_gb":4.0,"neighbour_reserve_gb":1.5,"neighbours":[{"kind":"service","name":"host_daemon","observation_key":"host_daemon","ref":"hatch daemon"},{"kind":"device","name":"thermal_sensor","observation_key":"thermal_sensor","ref":"/sys/class/thermal/thermal_zone*"}],"profile":"yggdrasil-vm-citizen-v1","roadmap_slice":"Y-035","version":1}